{
  "$schema": "./ac-feasibility-prompts-schema.json",
  "version": 1,
  "classify": {
    "question": "For each proposed AC, is it about (a) what we ship — a concrete deliverable observable in the codebase — or (b) how we verify a deliverable — a test/check that produces pass/fail?",
    "guidance": "Deliverable ACs name a file, function, section, or behavior. Verification ACs name a test, a parity check, a comparison, or an assertion. Many ACs mix both — split them."
  },
  "verificationGate": {
    "question": "For each verification AC, name the mechanism explicitly (e.g., 'Jest unit test', 'contract-parity token-presence assertion', 'one-time manual check in a qa-required issue', 'subprocess CLI invocation'). Then: does any existing test in this repo use that mechanism?",
    "actionIfNo": "Either (a) rewrite the AC to use a mechanism already in use, (b) commit to a feasibility spike — a throwaway test that proves the mechanism works — and reference its issue number, or (c) name an honest weaker mechanism (contract-parity, or a one-time manual check) that does exist. WHERE a manual check lives is part of naming it: a feature-specific manual check belongs in its own standalone qa-required issue, which is a gate with an owner and a closure condition. NEVER append it to /prepare-release's Summary Checklist — that checklist is release mechanics, it ships to downstream projects where a framework-owned step has no audience and cannot be removed, and it has no admission rule, no audience test and no retirement condition, so entries accumulate and outlive the fix they were verifying (#2940).",
    "triggerPhrases": [
      "Agent subagent",
      "Agent following",
      "LLM-driven parity",
      "asserts equivalence",
      "exact for the",
      "parity test",
      "subagent following",
      "Claude follows the procedure"
    ]
  },
  "deliverableSplit": {
    "question": "When a single AC bundles deliverable + verification (e.g., 'the skill has a fallback path AND output matches the script'), split into two ACs so each is independently judgable.",
    "guidance": "AC-Deliverable: the skill has a fallback path with documented inputs/outputs. AC-Verification: <mechanism> asserts <invariant> against <fixture>. The implementer can renegotiate the verification AC if the mechanism turns out to be infeasible without renegotiating what shipped. Applies equally to epic success criteria: 'N specialists rewritten in opinion-dense format, each user-reviewed via /review-issue' bundles a deliverable that was fully satisfied with a verification that could not be — and one checkbox cannot express that split state.",
    "appliesTo": [
      "story acceptance criteria",
      "bug acceptance criteria",
      "enhancement acceptance criteria",
      "epic success criteria"
    ]
  },
  "phaseFeasibility": {
    "question": "For each AC, which workflow phase owns its completion condition — implementation (resolves while the story is worked), review (resolves after the story reaches in_review), or release (resolves during /prepare-release)? An AC owned by a later phase cannot be checked before the in_review move, and `gh pmu move` validates checkboxes.",
    "guidance": "This is a different question from verificationGate. verificationGate asks whether the named mechanism exists; phaseFeasibility asks whether the condition can resolve in time. An AC can name a mechanism that exists and still be unsatisfiable — 'user-reviewed and approved before merge' names a real review process whose output simply does not exist yet when the box must be checked. Judge by asking: at the moment /work reaches Step 5, is this condition knowably true? If not, the AC is out of phase.",
    "actionIfOutOfPhase": "Two dispositions, decided by whether another command's checklist already owns the work. (a) OWNED ELSEWHERE — the obligation appears in the `ownedElsewhere` list below: DROP the AC. Do not annotate it. A story checkbox for CHANGELOG or tagging duplicates an obligation /prepare-release already discharges and creates a second place to mark it done. (b) NOT OWNED — the gate is genuinely load-bearing for this story (a required human review, a sign-off): keep it and emit it pre-annotated using `annotationFormat`, choosing the `gatePhases` token whose phase owns the condition. Prefer annotation over deletion when the requirement is real: the goal is to stop the gate deadlocking the transition, not to remove the requirement.",
    "gatePhases": ["review", "release"],
    "annotationFormat": "- [ ] {acText} → GATE: {phase}",
    "triggerPhrases": [
      "user-reviewed",
      "user reviewed",
      "reviewed and approved",
      "approved via",
      "approval recorded",
      "sign-off",
      "signed off",
      "before merge",
      "after merge",
      "once merged",
      "at release time",
      "on release",
      "post-release",
      "when released",
      "in CHANGELOG",
      "in the CHANGELOG"
    ],
    "ownedElsewhere": [
      {
        "work": "CHANGELOG entry for this change",
        "owner": "/prepare-release",
        "ownerChecklistItem": "- [ ] CHANGELOG updated"
      },
      {
        "work": "Version tag creation and push",
        "owner": "/prepare-release",
        "ownerChecklistItem": "- [ ] Tag pushed"
      },
      {
        "work": "GitHub Release publication and release notes",
        "owner": "/prepare-release",
        "ownerChecklistItem": "- [ ] GitHub Release created"
      },
      {
        "work": "Release asset verification after deployment",
        "owner": "/prepare-release",
        "ownerChecklistItem": "- [ ] Release assets verified"
      }
    ]
  },
  "dischargedByWorkflow": {
    "question": "Does this AC restate a check a /work step already runs on every issue — the project's own test command passing?",
    "guidance": "Not a phase question: the condition resolves during implementation. It duplicates the /work Step 4f verification sweep, which runs every declared verification command before in_review, so an AC restating it is worked as its own deliverable and the suite runs twice. Judge by what the AC asks for, not its wording — 'npm test passes', 'the test suite passes' and 'all tests green' are the same AC.",
    "action": "DROP the AC and tell the user which step owns it (the entry's `owner`). Do not annotate it — there is no gate to wait for. Keep it, unchanged, when the entry's `keptWhen` condition holds: there Step 4f runs nothing, so the AC is the only test run the issue gets.",
    "entries": [
      {
        "work": "The project test suite passes",
        "owner": "/work Step 4f",
        "examples": [
          "`npm test` passes",
          "the test suite passes",
          "all tests pass"
        ],
        "keptWhen": "The project's verification set resolves to `none` (no verificationCommands, testCommand or testing.suites declared) — Step 4f then runs nothing."
      }
    ]
  }
}
